Symbol,Name,Last Sale,Net Change,% Change,Market Cap,Country,IPO Year,Volume,Sector,Industry
PRVA,Privia Health Group Inc. Common Stock,$17.65,0.17,0.973%,2110321756.00,United States,2021,368847,Health Care,Medical/Nursing Services
PRZO,ParaZero Technologies Ltd. Ordinary Shares,$0.625,0.0245,4.08%,6975000.00,Israel,2023,41107,Industrials,Military/Government/Technical
PSA,Public Storage Common Stock,$336.34,-2.07,-0.612%,58865697065.00,United States,,554719,Real Estate,Real Estate Investment Trusts
PSA^F,Public Storage Depositary Shares Each Representing 1/1000 of a 5.15% Cumulative Preferred Share of Beneficial Interest Series F par value $0.01 per share,$24.40,-0.08,-0.327%,,United States,,19349,,
PSA^G,Public Storage Depositary Shares Each Representing 1/1000 of a 5.05% Cumulative Preferred Share of Beneficial Interest Series G,$24.31,-0.12,-0.491%,,United States,,16608,,
PSA^H,Public Storage Depositary Shares Each Representing 1/1000 of a  5.60% Cumulative Preferred  Share of Beneficial Interest Series H,$25.05,0.005,0.02%,,United States,,13005,,
PSA^I,Public Storage Depositary Shares Each Representing 1/1000 of a 4.875% Cumulative Preferred Share of Beneficial Interest Series I par value $0.01 per share,$23.13,-0.03,-0.13%,,United States,,15311,,
PSA^J,Public Storage Depositary Shares Each Representing 1/1000 of a 4.700% Cumulative Preferred Share of Beneficial Interest Series J par value $0.01 per share,$22.49,0.0201,0.089%,,United States,,9042,,
PSA^K,Public Storage Depositary Shares Each Representing 1/1000 of a 4.75% Cumulative Preferred Share of Beneficial Interest Series K,$22.45,-0.04,-0.178%,,United States,,7639,,
PSA^L,Public Storage Depositary Shares Each Representing 1/1000 of a 4.625% Cumulative Preferred Share of Beneficial Interest Series L par value $0.01 per share,$21.77,-0.105,-0.48%,,United States,,23852,,
PSA^M,Public Storage Depositary Shares Each Representing 1/1000 of a 4.125% Cumulative Preferred Share of Beneficial Interest Series M,$19.88,-0.09,-0.451%,,United States,,8421,,
PSA^N,Public Storage Depositary Shares Each Representing 1/1000 of a 3.875% Cumulative Preferred Share of Beneficial Interest Series N,$18.31,-0.11,-0.597%,,United States,,8291,,
PSA^O,Public Storage Depositary Shares Each Representing 1/1000 of a 3.900% Cumulative Preferred Share of Beneficial Interest Series O,$18.40,-0.105,-0.567%,,United States,,93457,,
PSA^P,Public Storage Depositary Shares Each Representing 1/1000 of a 4.000% Cumulative Preferred Share of Bene cial Interest Series P,$18.90,-0.23,-1.202%,,United States,,38931,,
PSA^Q,Public Storage Depositary Shares Each Representing 1/1000 of a 3.950% Cumulative Preferred Share of Beneficial Interest Series Q par value $0.01 per share,$18.78,-0.10,-0.53%,,United States,,6605,,
PSA^R,Public Storage Depositary Shares Each Representing 1/1000 of a 4.00% Cumulative Preferred Share of Bene cial Interest Series R,$19.28,0.01,0.052%,,United States,,23556,,
PSA^S,Public Storage Depositary Shares Each Representing 1/1000 of a 4.100% Cumulative Preferred Share of Beneficial Interest Series S,$19.70,-0.15,-0.756%,,United States,,10503,,
PSBD,Palmer Square Capital BDC Inc. Common Stock,$16.25,0.00,0.00%,0.00,,2024,27965,,
PSEC,Prospect Capital Corporation Common Stock,$5.31,-0.03,-0.562%,2277927432.00,United States,2004,3034384,Finance,Finance: Consumer Services
PSEC^A,Prospect Capital Corporation 5.35% Series A Fixed Rate Cumulative Perpetual Preferred Stock,$19.44,0.30,1.567%,,United States,,6725,,
PSF,Cohen & Steers Select Preferred and Income Fund Inc. Common Stock,$20.65,0.02,0.097%,1014712668.00,,2010,36132,Finance,Investment Managers
PSFE,Paysafe Limited Common Shares,$21.91,0.10,0.459%,1352272996.00,,2021,109332,Consumer Discretionary,Business Services
PSHG,Performance Shipping Inc. Common Shares,$2.07,0.01,0.485%,25418929.00,Greece,,48423,Consumer Discretionary,Marine Transportation
PSIG,PS International Group Ltd. Ordinary Shares,$0.7991,0.012,1.525%,19404495.00,Hong Kong,,60134,Consumer Discretionary,Oil Refining/Marketing
PSMT,PriceSmart Inc. Common Stock,$91.70,-1.20,-1.292%,2809595658.00,United States,,81932,Consumer Discretionary,Department/Specialty Retail Stores
PSN,Parsons Corporation Common Stock,$104.21,-0.20,-0.192%,11065552606.00,United States,2019,731976,Technology,EDP Services
PSNL,Personalis Inc. Common Stock,$4.71,0.01,0.213%,310483200.00,United States,2019,313549,Health Care,Medical Specialities
PSNY,Polestar Automotive Holding UK PLC Class A ADS,$1.33,0.02,1.527%,2839829683.00,Sweden,,3103802,Consumer Discretionary,Auto Manufacturing
PSNYW,Polestar Automotive Holding UK PLC Class C-1 ADS (ADW),$0.2225,0.0002,0.09%,475084289.00,Sweden,,25713,Consumer Discretionary,Auto Manufacturing
PSO,Pearson Plc Common Stock,$13.52,0.00,0.00%,9007049201.00,United Kingdom,,237586,Consumer Discretionary,Books
PSQH,PSQ Holdings Inc. Class A Common Stock,$2.67,-0.06,-2.198%,83815559.00,,2021,76788,Consumer Discretionary,Advertising
PSTG,Pure Storage Inc. Class A Common Stock,$54.05,0.60,1.123%,17711746871.00,United States,2015,1513671,Technology,Electronic Components
PSTL,Postal Realty Trust Inc. Class A Common Stock,$14.31,-0.30,-2.053%,329606895.00,United States,2019,72643,Real Estate,Real Estate Investment Trusts
PSTV,PLUS THERAPEUTICS Inc. Common Stock ,$1.35,-0.0001,-0.007%,7960050.00,United States,,22169,Health Care,Medical/Dental Instruments
PSTX,Poseida Therapeutics Inc. Common Stock,$2.41,-0.01,-0.413%,234059622.00,United States,2020,225807,Health Care,Biotechnology: Biological Products (No Diagnostic Substances)
PSX,Phillips 66 Common Stock,$128.17,-0.32,-0.249%,53648012185.00,United States,,1345434,Energy,Integrated oil Companies
PT,Pintec Technology Holdings Limited American Depositary Shares,$1.00,0.00,0.00%,15947961.00,China,2018,52279,Technology,Computer Software: Programming Data Processing
PTA,Cohen & Steers Tax-Advantaged Preferred Securities and Income Fund Common Shares of Beneficial Interest,$20.58,-0.03,-0.146%,1137527745.00,United States,2020,72881,Finance,Trusts Except Educational Religious and Charitable
PTC,PTC Inc. Common Stock,$187.01,3.38,1.841%,22466489549.00,United States,,802472,Technology,Computer Software: Prepackaged Software
PTCT,PTC Therapeutics Inc. Common Stock,$40.75,-0.65,-1.57%,3134659928.00,United States,2013,948356,Health Care,Biotechnology: Pharmaceutical Preparations
PTEN,Patterson-UTI Energy Inc. Common Stock,$8.17,0.20,2.509%,3211216907.00,United States,1993,12012969,Energy,Oil & Gas Production
PTGX,Protagonist Therapeutics Inc. Common Stock,$47.26,0.31,0.66%,2783830687.00,United States,2016,300209,Health Care,Biotechnology: Pharmaceutical Preparations
PTHL,Pheton Holdings Ltd Class A Ordinary Shares,$4.55,0.07,1.563%,65975000.00,China,2024,103747,Health Care,Biotechnology: Electromedical & Electrotherapeutic Apparatus
PTIX,Protagenic Therapeutics Inc. Common Stock,$0.613,-0.0273,-4.264%,2738434.00,United States,,15349,Health Care,Biotechnology: Pharmaceutical Preparations
PTIXW,Protagenic Therapeutics Inc. Warrant,$0.009,0.00,0.00%,40205.00,United States,,13572,Health Care,Biotechnology: Pharmaceutical Preparations
PTLE,PTL LTD Ordinary Shares,$4.11,-0.0001,-0.002%,51375000.00,Singapore,2024,15985,Energy,Oil Refining/Marketing
PTLO,Portillo's Inc. Class A Common Stock,$12.89,0.01,0.078%,796532678.00,United States,2021,1008665,Consumer Discretionary,Restaurants
PTMN,Portman Ridge Finance Corporation Common Stock,$18.35,-0.03,-0.163%,169627840.00,United States,2006,15120,Finance,Finance: Consumer Services
PTN,Palatin Technologies Inc. Common Stock,$1.09,-0.01,-0.909%,21307502.00,United States,1999,263019,Health Care,Biotechnology: Pharmaceutical Preparations
PTON,Peloton Interactive Inc. Class A Common Stock,$6.28,0.14,2.28%,2363913895.00,United States,2019,14355178,Consumer Discretionary,Recreational Games/Products/Toys
PTPI,Petros Pharmaceuticals Inc. Common Stock,$0.4077,0.0467,12.936%,3916643.00,United States,,429971,Health Care,Biotechnology: Pharmaceutical Preparations
PTSI,P.A.M. Transportation Services Inc. Common Stock,$16.15,0.69,4.463%,351343428.00,United States,1986,15919,Industrials,Trucking Freight/Courier Services
PTVE,Pactiv Evergreen Inc. Common stock,$11.54,-0.09,-0.774%,2068598511.00,United States,2020,119741,Consumer Discretionary,Containers/Packaging
PTY,Pimco Corporate & Income Opportunity Fund,$14.52,0.01,0.069%,0.00,United States,2002,372001,Finance,Investment Managers
PUBM,PubMatic Inc. Class A Common Stock,$14.79,-0.05,-0.337%,733349002.00,United States,2020,228465,Technology,Computer Software: Programming Data Processing
PUK,Prudential Public Limited Company Common Stock,$16.65,-0.34,-2.001%,22516440121.00,United Kingdom,,1415413,Finance,Life Insurance
PULM,Pulmatrix Inc. Common Stock,$2.0199,0.0199,0.995%,7377250.00,United States,2014,8400,Health Care,Biotechnology: Pharmaceutical Preparations
PUMP,ProPetro Holding Corp. Common Stock,$7.75,0.16,2.108%,807256872.00,United States,2017,709000,Energy,Oilfield Services/Equipment
PVBC,Provident Bancorp Inc. (MD) Common Stock,$10.36,-0.41,-3.807%,183033508.00,United States,2015,16279,Finance,Banks
PVH,PVH Corp. Common Stock,$93.26,-0.05,-0.054%,5205222779.00,United States,,541844,Consumer Discretionary,Apparel
PVL,Permianville Royalty Trust Trust Units ,$1.59,0.01,0.633%,52470000.00,United States,2011,32838,Energy,Oil & Gas Production
PW,Power REIT (MD) Common Stock,$1.11,0.02,1.835%,3762524.00,United States,1998,54002,Real Estate,Real Estate Investment Trusts
PW^A,Power REIT 7.75% Series A Cumulative Perpetual Preferred Stock,$3.46,-0.04,-1.143%,,United States,,101,,
PWM,Prestige Wealth Inc. Class A Ordinary Shares,$0.81,0.02,2.532%,7411500.00,Hong Kong,2023,144277,Finance,Finance: Consumer Services
PWOD,Penns Woods Bancorp Inc. Common Stock,$25.60,-0.15,-0.583%,193139994.00,United States,,5978,Finance,Major Banks
PWP,Perella Weinberg Partners Class A Common Stock,$20.42,-0.11,-0.536%,1752836832.00,United States,2020,234579,Finance,Finance: Consumer Services
PWR,Quanta Services Inc. Common Stock,$308.17,-1.70,-0.549%,45402617994.00,United States,,671355,Industrials,Engineering & Construction
PWUP,PowerUp Acquisition Corp. Class A Ordinary Shares,$11.69,0.13,1.125%,0.00,United States,2022,100,Finance,Blank Checks
PWUPU,PowerUp Acquisition Corp. Unit,$11.45,-0.06,-0.521%,0.00,United States,2022,500,Finance,Blank Checks
PWUPW,PowerUp Acquisition Corp. Warrant,$0.032,0.0029,9.966%,0.00,United States,2022,13600,Finance,Blank Checks
PX,P10 Inc. Class A Common Stock,$11.12,0.04,0.361%,1241869346.00,United States,2021,266431,Finance,Investment Managers
PXDT,Pixie Dust Technologies Inc. American Depositary Shares ,$0.67,-0.36,-34.951%,9962275.00,Japan,2023,2839096,Health Care,Biotechnology: Electromedical & Electrotherapeutic Apparatus
PXLW,Pixelworks Inc.  Common Stock,$0.746,-0.017,-2.228%,43679556.00,United States,2000,111968,Technology,Semiconductors
PXS,Pyxis Tankers Inc. Common Stock,$4.67,0.06,1.302%,49233694.00,Greece,,72161,Consumer Discretionary,Marine Transportation
PXSAW,Pyxis Tankers Inc. Warrant,$0.7499,0.0499,7.129%,7905856.00,Greece,,901,Consumer Discretionary,Marine Transportation
PYCR,Paycor HCM Inc. Common Stock,$14.35,0.04,0.28%,2566097350.00,United States,2021,610616,Technology,Computer Software: Prepackaged Software
PYN,PIMCO New York Municipal Income Fund III Common Shares of Beneficial Interest,$6.04,0.03,0.499%,0.00,United States,2002,36774,Finance,Investment Managers
PYPD,PolyPid Ltd. Ordinary Shares,$3.32,-0.154,-4.433%,22587547.00,Israel,2020,16246,Health Care,Biotechnology: Pharmaceutical Preparations
PYPL,PayPal Holdings Inc. Common Stock,$81.70,0.31,0.381%,83524638208.00,United States,,7191086,Consumer Discretionary,Business Services
PYT,PPlus Tr GSC-2 Tr Ctf Fltg Rate,$23.00,0.00,0.00%,0.00,United States,,106,Finance,Finance: Consumer Services
PYXS,Pyxis Oncology Inc. Common Stock,$3.66,-0.09,-2.40%,215728609.00,United States,2021,543693,Health Care,Biotechnology: Pharmaceutical Preparations
PZC,PIMCO California Municipal Income Fund III Common Shares of Beneficial Interest,$7.35,0.06,0.823%,0.00,United States,2002,26353,Finance,Investment Managers
PZG,Paramount Gold Nevada Corp. Common Stock,$0.4132,-0.0066,-1.572%,26923791.00,United States,2015,71599,Basic Materials,Metal Mining
PZZA,Papa John's International Inc. Common Stock,$51.02,0.29,0.572%,1664572704.00,United States,1993,620309,Consumer Discretionary,Restaurants
QBTS,D-Wave Quantum Inc. Common Shares,$1.04,-0.10,-8.772%,209486469.00,,2022,11182678,Technology,EDP Services
QCOM,QUALCOMM Incorporated Common Stock,$170.27,2.17,1.291%,189680780000.00,United States,1991,5494304,Technology,Radio And Television Broadcasting And Communications Equipment
QCRH,QCR Holdings Inc. Common Stock,$78.66,0.50,0.64%,1324785663.00,United States,,72594,Finance,Major Banks
QD,Qudian Inc. American Depositary Shares each representing one Class A Ordinary Share,$2.35,0.06,2.62%,445099050.00,China,2017,435396,Finance,Finance: Consumer Services
QDEL,QuidelOrtho Corporation Common Stock,$38.68,-0.11,-0.284%,2600665040.00,United States,,460462,Health Care,Biotechnology: In Vitro & In Vivo Diagnostic Substances
QETA,Quetta Acquisition Corporation Common Stock,$10.4646,0.00,0.00%,0.00,United States,2023,1,Finance,Blank Checks
QETAR,Quetta Acquisition Corporation Right,$1.525,0.235,18.217%,0.00,United States,2023,13756,Finance,Blank Checks
QETAU,Quetta Acquisition Corporation Unit,$10.54,0.03,0.285%,0.00,United States,2023,231,Finance,Blank Checks
QFIN,Qifu Technology Inc. American Depositary Shares,$34.82,1.36,4.065%,5405960820.00,China,2018,2229250,Finance,Finance: Consumer Services
QGEN,Qiagen N.V. Common Shares,$41.55,-0.05,-0.12%,9481824470.00,Netherlands,,492399,Health Care,Biotechnology: Biological Products (No Diagnostic Substances)
QH,Quhuo Limited American Depository Shares,$1.39,-0.08,-5.442%,8572993.00,China,2020,99165,Consumer Discretionary,Business Services
QIPT,Quipt Home Medical Corp. Common Shares,$2.71,0.05,1.88%,116773900.00,United States,,218130,Health Care,Misc Health and Biotechnology Services
QLGN,Qualigen Therapeutics Inc. Common Stock,$0.1215,0.0134,12.396%,1476933.00,United States,2015,52020077,Health Care,Biotechnology: Pharmaceutical Preparations
QLYS,Qualys Inc. Common Stock,$121.12,1.20,1.001%,4458550500.00,United States,2012,357311,Technology,Computer Software: Prepackaged Software
QMCO,Quantum Corporation Common Stock,$4.96,-0.33,-6.238%,23771742.00,United States,,34654,Technology,Electronic Components
QMMM,QMMM Holdings Limited Ordinary Shares,$9.36,0.11,1.189%,160290000.00,Hong Kong,2024,160869,Consumer Discretionary,Advertising
QNCX,Quince Therapeutics Inc. Common Stock,$1.08,-0.11,-9.244%,46738734.00,United States,2019,1098212,Health Care,Biotechnology: Biological Products (No Diagnostic Substances)
QNRX,Quoin Pharmaceuticals Ltd. American Depositary Shares,$0.808,-0.0238,-2.861%,3215816.00,Israel,2016,295579,Health Care,Medical/Dental Instruments
QNST,QuinStreet Inc. Common Stock,$18.57,0.28,1.531%,1039476066.00,United States,2010,214738,Consumer Discretionary,Business Services
QNTM,Quantum Biopharma Ltd. Class B Subordinate Voting Shares,$5.664,-0.026,-0.457%,7365919.00,Canada,,60658,Health Care,Biotechnology: Pharmaceutical Preparations
QOMO,Qomolangma Acquisition Corp. Common Stock,$11.40,0.00,0.00%,0.00,United States,2022,5,Finance,Blank Checks
QOMOU,Qomolangma Acquisition Corp. Unit,$11.31,-0.19,-1.652%,0.00,United States,2022,415,Finance,Blank Checks
QOMOW,Qomolangma Acquisition Corp. Warrant,$0.0261,0.0031,13.478%,0.00,United States,2022,98702,Finance,Blank Checks
QQQX,Nuveen NASDAQ 100 Dynamic Overwrite Fund Shares of Beneficial Interest,$25.45,0.16,0.633%,0.00,United States,,91922,Finance,Finance Companies
QRHC,Quest Resource Holding Corporation Common Stock,$8.04,-0.15,-1.832%,163882962.00,United States,,18896,Utilities,Environmental Services
QRTEA,Qurate Retail Inc. Series A Common Stock ,$0.5426,-0.0259,-4.556%,215369631.00,United States,,1971580,Consumer Discretionary,Catalog/Specialty Distribution
QRTEB,Qurate Retail Inc. Series B Common Stock ,$3.40,-0.08,-2.299%,1349533256.00,United States,,1285,Consumer Discretionary,Catalog/Specialty Distribution
QRTEP,Qurate Retail Inc. 8.0% Fixed Rate Cumulative Redeemable Preferred Stock,$38.95,-0.05,-0.128%,15460094217.00,United States,,33417,Consumer Discretionary,Catalog/Specialty Distribution
QRVO,Qorvo Inc. Common Stock,$99.01,-0.52,-0.522%,9392221867.00,United States,,1325159,Technology,Semiconductors
QS,QuantumScape Corporation Class A Common Stock,$6.19,-0.31,-4.769%,3132843017.00,United States,2020,20606005,Miscellaneous,Industrial Machinery/Components
QSG,QuantaSing Group Limited American Depositary Shares,$2.68,-0.12,-4.286%,136982848.00,China,2023,47795,Real Estate,Other Consumer Services
QSI,Quantum-Si Incorporated Class A Common Stock,$0.745,-0.0305,-3.933%,106059170.00,United States,2020,573012,Industrials,Industrial Machinery/Components
QSIAW,Quantum-Si Incorporated Warrant,$0.0687,-0.0013,-1.857%,9780221.00,United States,2020,44165,Industrials,Industrial Machinery/Components
QSR,Restaurant Brands International Inc. Common Shares,$70.54,-1.65,-2.286%,31785444130.00,Canada,2014,953838,Consumer Discretionary,Restaurants
QTI,QT Imaging Holdings Inc. Common Stock,$0.709,0.019,2.754%,15201964.00,United States,,28025,Health Care,Biotechnology: Electromedical & Electrotherapeutic Apparatus
QTRX,Quanterix Corporation Common Stock,$12.47,0.26,2.129%,478586542.00,United States,2017,624784,Industrials,Biotechnology: Laboratory Analytical Instruments
QTTB,Q32 Bio Inc. Common Stock,$50.59,2.97,6.237%,610104574.00,United States,2018,155413,Health Care,Biotechnology: Pharmaceutical Preparations
QTWO,Q2 Holdings Inc. Common Stock,$83.36,-0.21,-0.251%,5025205218.00,United States,2014,500499,Technology,Computer Software: Prepackaged Software
QUAD,Quad Graphics Inc Class A Common Stock,$5.11,-0.35,-6.41%,266543017.00,United States,,239869,Consumer Discretionary,Publishing
QUBT,Quantum Computing Inc. Common Stock,$1.09,-0.01,-0.909%,99566203.00,United States,,2229627,Technology,Computer Software: Prepackaged Software
QUIK,QuickLogic Corporation Common Stock,$8.57,0.16,1.902%,123970269.00,United States,1999,49384,Technology,Semiconductors
QURE,uniQure N.V. Ordinary Shares,$6.535,0.055,0.849%,318238940.00,Netherlands,2014,634741,Health Care,Biotechnology: Pharmaceutical Preparations
QVCC,QVC Inc. 6.250% Senior Secured Notes due 2068,$13.67,-0.15,-1.085%,14.00,United States,2019,33580,Consumer Discretionary,Catalog/Specialty Distribution
QVCD,QVC Inc. 6.375% Senior Secured Notes due 2067,$13.87,0.021,0.152%,14.00,United States,2018,8963,Consumer Discretionary,Catalog/Specialty Distribution
QXO,QXO Inc. Common Stock,$15.09,0.21,1.411%,6178301643.00,United States,,631799,Technology,EDP Services
R,Ryder System Inc. Common Stock,$139.76,0.90,0.648%,6049257656.00,United States,,316647,Consumer Discretionary,Rental/Leasing Companies
RA,Brookfield Real Assets Income Fund Inc. Common Stock,$13.38,0.09,0.677%,0.00,United States,2016,233782,Finance,Investment Managers
RACE,Ferrari N.V. Common Shares,$484.73,-1.75,-0.36%,118153403810.00,Italy,2015,206657,Consumer Discretionary,Auto Manufacturing
RAIL,FreightCar America Inc. Common Stock,$14.57,0.48,3.407%,274991995.00,United States,2005,479796,Industrials,Railroads
RAMP,LiveRamp Holdings Inc. Common Stock,$24.74,0.98,4.125%,1647972122.00,United States,2018,452958,Technology,EDP Services
RAND,Rand Capital Corporation Common Stock,$16.4101,0.00,0.00%,42354813.00,United States,,11,Finance,Finance: Consumer Services
RANI,Rani Therapeutics Holdings Inc. Class A Common Stock,$2.34,-0.05,-2.092%,124971229.00,United States,2021,811153,Health Care,Biotechnology: Pharmaceutical Preparations
RAPP,Rapport Therapeutics Inc. Common Stock,$24.22,-0.61,-2.457%,885881789.00,United States,2024,63614,Health Care,Biotechnology: Pharmaceutical Preparations
RAPT,RAPT Therapeutics Inc. Common Stock,$1.89,0.12,6.78%,65967570.00,United States,2019,218700,Health Care,Biotechnology: Pharmaceutical Preparations
RARE,Ultragenyx Pharmaceutical Inc. Common Stock,$53.82,-1.00,-1.824%,4960330526.00,United States,2014,427146,Health Care,Biotechnology: Pharmaceutical Preparations
RAVE,Rave Restaurant Group Inc. Common Stock,$2.77,-0.095,-3.316%,40404788.00,United States,,19583,Consumer Discretionary,Food Distributors
RAY,Raytech Holding Limited Ordinary Shares,$1.40,-0.01,-0.709%,24658316.00,Hong Kong,2024,17773,Consumer Discretionary,Consumer Electronics/Appliances
RAYA,Erayak Power Solution Group Inc. Class A Ordinary Shares,$1.365,-0.005,-0.365%,16994250.00,China,2022,29163,Consumer Discretionary,Metal Fabrications
RBA,RB Global Inc. Common Stock,$84.94,0.33,0.39%,15650535185.00,Canada,,518822,Consumer Discretionary,Business Services
RBB,RBB Bancorp Common Stock,$22.13,-0.58,-2.554%,394019958.00,United States,2017,14633,Finance,Major Banks
RBBN,Ribbon Communications Inc. Common Stock,$3.70,-0.01,-0.27%,645748405.00,United States,,558479,Technology,EDP Services
RBC,RBC Bearings Incorporated Common Stock,$288.84,0.68,0.236%,8442753629.00,United States,2022,93520,Industrials,Metal Fabrications
RBCAA,Republic Bancorp Inc. Class A Common Stock,$67.03,-1.15,-1.687%,1302666047.00,United States,1998,13753,Finance,Major Banks
RBKB,Rhinebeck Bancorp Inc. Common Stock,$8.81,-0.09,-1.011%,97681818.00,United States,2019,6551,Finance,Banks
RBLX,Roblox Corporation Class A Common Stock,$42.14,0.36,0.862%,27273008000.00,United States,2021,7140551,Technology,Computer Software: Prepackaged Software
RBOT,Vicarious Surgical Inc. Class A Common Stock,$7.9406,-0.0894,-1.113%,46828124.00,Hong Kong,2020,7409,Health Care,Industrial Specialties
RBRK,Rubrik Inc. Class A Common Stock,$39.40,0.49,1.259%,7157136513.00,United States,2024,1519603,Technology,Computer Software: Prepackaged Software
RC,Ready Capital Corporation Common Stock,$6.87,-0.17,-2.415%,1155635944.00,United States,2013,1498613,Real Estate,Real Estate Investment Trusts
RC^C,Ready Capital Corporation 6.25% Series C Cumulative Convertible Preferred Stock,$19.00,0.00,0.00%,,United States,,10,,
RC^E,Ready Capital Corporation 6.50% Series E Cumulative Redeemable Preferred Stock,$19.275,-0.0451,-0.233%,,United States,,3888,,
RCAT,Red Cat Holdings Inc. Common Stock,$2.69,-0.03,-1.103%,202850312.00,United States,,737327,Technology,Computer Software: Prepackaged Software
RCB,Ready Capital Corporation 6.20% Senior Notes due 2026,$24.4454,-0.0245,-0.10%,4112079025.00,United States,2019,2129,Real Estate,Real Estate Investment Trusts
RCC,Ready Capital Corporation 5.75% Senior Notes due 2026,$24.36,-0.04,-0.164%,4097713478.00,United States,2021,23679,Real Estate,Real Estate Investment Trusts
RCEL,Avita Medical Inc. Common Stock,$10.13,0.00,0.00%,263275651.00,United States,,46911,Health Care,Medical/Dental Instruments
RCFA,Perception Capital Corp. IV Class A Ordinary Shares,$11.506,0.006,0.052%,0.00,,2021,1800,Finance,Blank Checks
RCG,RENN Fund Inc Common Stock,$2.16,-0.01,-0.461%,0.00,United States,,29631,Finance,Investment Managers
RCI,Rogers Communication Inc. Common Stock,$37.14,-0.85,-2.237%,19731166093.00,Canada,,985767,Telecommunications,Cable & Other Pay Television Services
RCKT,Rocket Pharmaceuticals Inc. Common Stock,$17.04,-0.18,-1.045%,1550228637.00,United States,2015,467565,Health Care,Biotechnology: Pharmaceutical Preparations
RCKTW,Rocket Pharmaceuticals Inc. Warrant,$0.0665,0.00,0.00%,6049895.00,United States,,2,Health Care,Biotechnology: Pharmaceutical Preparations
RCKY,Rocky Brands Inc. Common Stock,$27.40,0.51,1.897%,204103148.00,United States,1993,22699,Consumer Discretionary,Shoe Manufacturing
RCL,Royal Caribbean Cruises Ltd. Common Stock,$200.91,-2.14,-1.054%,51718320710.00,United States,1993,976471,Consumer Discretionary,Marine Transportation
RCM,R1 RCM Inc. Common Stock,$14.25,0.01,0.07%,6015052723.00,United States,,806043,Consumer Discretionary,Other Consumer Services
RCMT,RCM Technologies Inc. Common Stock,$20.97,-0.08,-0.38%,159979459.00,United States,,23963,Consumer Discretionary,Professional Services
RCON,Recon Technology Ltd. Class A Ordinary Shares,$3.47,0.11,3.274%,51973507.00,China,2009,21394,Energy,Oilfield Services/Equipment
RCS,PIMCO Strategic Income Fund Inc.,$7.50,0.06,0.806%,0.00,United States,1994,63299,Finance,Investment Managers
RCUS,Arcus Biosciences Inc. Common Stock,$16.32,-1.51,-8.469%,1492096882.00,United States,2018,958111,Health Care,Biotechnology: Pharmaceutical Preparations
RDACU,Rising Dragon Acquisition Corp. Unit,$10.01,0.00,0.00%,0.00,China,2024,52635,Finance,Blank Checks
RDCM,Radcom Ltd. Ordinary Shares,$10.10,-0.49,-4.627%,154608093.00,Israel,1997,35835,Technology,Computer peripheral equipment
RDDT,Reddit Inc. Class A Common Stock,$81.36,2.76,3.511%,13495675753.00,United States,2024,3882110,Technology,EDP Services
RDFN,Redfin Corporation Common Stock,$9.99,-0.03,-0.299%,1216524857.00,United States,2017,3485999,Finance,Real Estate
RDHL,Redhill Biopharma Ltd. American Depositary Shares,$8.20,0.21,2.628%,10500420.00,Israel,,9568,Health Care,Biotechnology: Pharmaceutical Preparations
RDI,Reading International Inc Class A Common Stock,$1.45,0.00,0.00%,32517967.00,United States,,66691,Consumer Discretionary,Movies/Entertainment
RDIB,Reading International Inc Class B Common Stock,$6.92,-0.156,-2.205%,155189193.00,United States,,18773,Consumer Discretionary,Movies/Entertainment
RDN,Radian Group Inc. Common Stock,$33.56,-0.77,-2.243%,5048056774.00,United States,,540880,Finance,Property-Casualty Insurers
RDNT,RadNet Inc. Common Stock,$66.37,0.13,0.196%,4908543346.00,United States,,304510,Health Care,Medical Specialities
RDUS,Radius Recycling Inc. Class A Common Stock,$15.94,-0.40,-2.448%,446948897.00,United States,,146955,Consumer Discretionary,Industrial Specialties
RDVT,Red Violet Inc. Common Stock ,$28.57,-0.13,-0.453%,392309412.00,United States,,35233,Technology,Computer Software: Prepackaged Software
