Symbol,Name,Last Sale,Net Change,% Change,Market Cap,Country,IPO Year,Volume,Sector,Industry
JXJT,JX Luxventure Limited Common Stock,$1.41,0.01,0.714%,8549101.00,China,2013,163222,Consumer Staples,Apparel
JXN,Jackson Financial Inc. Class A Common Stock ,$98.25,-1.23,-1.236%,7392429822.00,United States,2021,481373,Finance,Life Insurance
JXN^A,Jackson Financial Inc. Depositary Shares each representing a 1/1000th interest in a share of Fixed-Rate Reset Noncumulative Perpetual Preferred Stock Series A,$27.22,-0.02,-0.073%,,United States,,32798,,
JYD,Jayud Global Logistics Limited Class A Ordinary Shares,$0.87,-0.04,-4.396%,18576434.00,China,2023,7936,Consumer Discretionary,Oil Refining/Marketing
JYNT,The Joint Corp. Common Stock,$11.20,-0.02,-0.178%,167963880.00,United States,2014,25430,Miscellaneous,Multi-Sector Companies
JZ,Jianzhi Education Technology Group Company Limited American Depositary Shs,$1.07,0.02,1.905%,21597950.00,China,2022,11378,Real Estate,Other Consumer Services
JZXN,Jiuzi Holdings Inc. Ordinary Shares,$1.54,0.0933,6.449%,13943157.00,China,2021,15385,Consumer Discretionary,Retail-Auto Dealers and Gas Stations
K,Kellanova Common Stock,$80.88,-0.15,-0.185%,27684236860.00,United States,,1894218,Consumer Staples,Packaged Foods
KACL,Kairous Acquisition Corp. Limited Ordinary Shares,$12.38,0.00,0.00%,0.00,Malaysia,2022,3,Finance,Blank Checks
KACLR,Kairous Acquisition Corp. Limited Rights,$0.0971,-0.0151,-13.458%,0.00,Malaysia,2022,285,Finance,Blank Checks
KAI,Kadant Inc Common Stock,$316.45,-1.52,-0.478%,3716567278.00,United States,1992,33206,Industrials,Industrial Machinery/Components
KALA,KALA BIO Inc. Common Stock,$6.80,0.25,3.817%,31331469.00,United States,2017,70775,Health Care,Biotechnology: Pharmaceutical Preparations
KALU,Kaiser Aluminum Corporation Common Stock,$68.34,1.80,2.705%,1099393234.00,United States,,289715,Industrials,Metal Fabrications
KALV,KalVista Pharmaceuticals Inc. Common Stock,$11.68,-0.39,-3.231%,504756713.00,United Kingdom,2015,119130,Health Care,Biotechnology: Pharmaceutical Preparations
KAPA,Kairos Pharma Ltd. Common Stock,$1.45,-0.05,-3.333%,18620809.00,,2024,35346,Health Care,Biotechnology: Pharmaceutical Preparations
KAR,OPENLANE Inc. Common Stock,$16.12,0.06,0.374%,1750943858.00,United States,2009,526172,Consumer Discretionary,Retail-Auto Dealers and Gas Stations
KARO,Karooooo Ltd. Ordinary Shares,$39.92,1.26,3.259%,1233528000.00,Singapore,2021,28135,Technology,Computer Software: Prepackaged Software
KAVL,Kaival Brands Innovations Group Inc. Common Stock,$1.0126,0.0625,6.578%,6869436.00,United States,,267630,Consumer Discretionary,Other Consumer Services
KB,KB Financial Group Inc,$72.18,5.22,7.796%,27331954889.00,South Korea,,341510,Finance,Commercial Banks
KBDC,Kayne Anderson BDC Inc. Common Stock,$16.35,-0.01,-0.061%,0.00,,2024,17761,,
KBH,KB Home Common Stock,$78.05,-0.61,-0.775%,5723755930.00,United States,1986,872173,Consumer Discretionary,Homebuilding
KBR,KBR Inc. Common Stock,$66.75,-0.30,-0.447%,8893903500.00,United States,2006,898255,Industrials,Military/Government/Technical
KC,Kingsoft Cloud Holdings Limited American Depositary Shares,$2.66,0.06,2.308%,674803837.00,China,2020,1521446,Technology,Computer Software: Prepackaged Software
KD,Kyndryl Holdings Inc. Common Stock,$24.07,-0.01,-0.042%,5565164140.00,United States,2021,1229141,Technology,EDP Services
KDLY,Kindly MD Inc. Common Stock,$1.02,-0.04,-3.774%,6066112.00,United States,2024,90686,Health Care,Medical/Nursing Services
KDLYW,Kindly MD Inc. Warrants,$0.1351,0.00,0.00%,803463.00,United States,2024,1,Health Care,Medical/Nursing Services
KDP,Keurig Dr Pepper Inc. Common Stock,$34.58,-0.36,-1.03%,46893466917.00,United States,,9207260,Consumer Staples,Beverages (Production/Distribution)
KE,Kimball Electronics Inc. Common Stock,$17.83,-0.01,-0.056%,440995773.00,United States,,83581,Technology,Electrical Products
KELYA,Kelly Services Inc. Class A Common Stock,$19.46,-0.30,-1.518%,692160013.00,United States,,107603,Consumer Discretionary,Professional Services
KELYB,Kelly Services Inc. Class B Common Stock,$19.3301,0.00,0.00%,687539685.00,United States,,30,Consumer Discretionary,Professional Services
KEN,Kenon Holdings Ltd. Ordinary Shares,$27.025,-0.065,-0.24%,1425996961.00,Singapore,2015,2935,Utilities,Electric Utilities: Central
KEP,Korea Electric Power Corporation Common Stock,$8.18,-0.11,-1.327%,10502532300.00,South Korea,1994,97986,Utilities,Electric Utilities: Central
KEQU,Kewaunee Scientific Corporation Common Stock,$32.65,0.08,0.246%,93764531.00,United States,,9740,Industrials,Medical Specialities
KEX,Kirby Corporation Common Stock,$125.50,1.76,1.422%,7266450000.00,United States,,493886,Consumer Discretionary,Marine Transportation
KEY,KeyCorp Common Stock,$17.04,-0.19,-1.103%,16072055290.00,United States,,7418171,Finance,Major Banks
KEY^I,KeyCorp Depositary Shares Each Representing a 1/40th Ownership Interest in a Share of Fixed-to-Floating Rate Perpetual Non-Cumulative Preferred Stock Series E,$25.24,0.00,0.00%,,United States,,18920,,
KEY^J,KeyCorp Depositary Shares each representing a 1/40th ownership interest in a share of Fixed Rate Perpetual Non-Cumulative Preferred Stock Series F,$22.75,-0.025,-0.11%,,United States,,24693,,
KEY^K,KeyCorp Depositary Shares each representing a 1/40th ownership interest in a share of Fixed Rate Perpetual Non-Cumulative Preferred Stock Series G,$23.33,0.06,0.258%,,United States,,25544,,
KEY^L,KeyCorp Depositary Shares each representing a 1/40th ownership interest in a share of Fixed Rate Perpetual Non-Cumulative Preferred Stock Series H,$24.97,0.19,0.767%,,United States,,57358,,
KEYS,Keysight Technologies Inc. Common Stock,$155.98,2.23,1.45%,27069292513.00,United States,2014,795942,Industrials,Industrial Machinery/Components
KF,Korea Fund Inc. (The) New Common Stock,$21.85,-0.03,-0.137%,0.00,United States,,3356,Finance,Investment Managers
KFFB,Kentucky First Federal Bancorp Common Stock,$3.16,0.0261,0.833%,25554019.00,United States,2005,6148,Finance,Savings Institutions
KFRC,Kforce Inc. Common Stock,$54.55,-0.67,-1.213%,1057124450.00,United States,1995,275626,Consumer Discretionary,Professional Services
KFS,Kingsway Financial Services Inc. Common Stock (DE),$8.92,-0.13,-1.436%,248073433.00,Canada,,11544,Finance,Property-Casualty Insurers
KFY,Korn Ferry Common Stock,$68.94,-0.30,-0.433%,3585613797.00,United States,1999,168425,Consumer Discretionary,Diversified Commercial Services
KGC,Kinross Gold Corporation Common Stock,$10.53,-0.22,-2.047%,12941370000.00,Canada,2001,13692790,Basic Materials,Precious Metals
KGEI,Kolibri Global Energy Inc. Common stock,$3.48,0.28,8.75%,124361158.00,United States,,21534,Energy,Oil & Gas Production
KGS,Kodiak Gas Services Inc. Common Stock,$31.36,0.66,2.15%,2650221432.00,United States,2023,545738,Utilities,Natural Gas Distribution
KHC,The Kraft Heinz Company Common Stock,$34.74,-0.29,-0.828%,42003400882.00,United States,,7532943,Consumer Staples,Packaged Foods
KIDS,OrthoPediatrics Corp. Common Stock,$25.69,0.08,0.312%,622068604.00,United States,2017,51840,Health Care,Medical/Dental Instruments
KIM,Kimco Realty Corporation (HC) Common Stock,$23.55,-0.40,-1.67%,15875341509.00,United States,,2810092,Real Estate,Real Estate Investment Trusts
KIM^L,Kimco Realty Corporation Class L Depositary Shares each of which represents a one-one thousandth fractional interest in a share of 5.125% Class L Cumulative Redeemable Preferred Stock liquidation preference $25000.00 per share,$22.68,-0.165,-0.722%,,United States,,16663,,
KIM^M,Kimco Realty Corporation Class M Depositary Shares each of which represents a one-one thousandth fractional interest in a share of 5.25% Class M Cumulative Redeemable Preferred Stock liquidation preference $25000.00 per share,$23.20,-0.11,-0.472%,,United States,,9448,,
KIM^N,Kimco Realty Corporation Depositary Shares each representing 1/1000th interest in a share of 7.25% Class N Cumulative Convertible Perpetual Preferred Stock,$60.99,-0.06,-0.098%,,United States,,3818,,
KIND,Nextdoor Holdings Inc. Class A Common Stock,$2.30,-0.03,-1.288%,873789348.00,United States,,760978,Technology,Computer Software: Programming Data Processing
KINS,Kingstone Companies Inc. Common Stock,$9.78,-0.12,-1.212%,108212991.00,United States,,60329,Finance,Property-Casualty Insurers
KIO,KKR Income Opportunities Fund Common Shares,$13.91,-0.10,-0.714%,0.00,United States,2013,256463,Finance,Investment Managers
KIRK,Kirkland's Inc. COMMONSTOCK,$1.84,-0.05,-2.646%,24125414.00,United States,2002,182316,Consumer Discretionary,Other Specialty Stores
KITT,Nauticus Robotics Inc. Common stock,$1.36,0.03,2.256%,6323497.00,United States,2021,51680,Industrials,Industrial Machinery/Components
KITTW,Nauticus Robotics Inc. Warrant,$0.013,0.00,0.00%,60445.00,United States,2021,22857,Industrials,Industrial Machinery/Components
KKR,KKR & Co. Inc. Common Stock,$139.88,-3.40,-2.373%,124135090275.00,United States,,2865636,Finance,Investment Managers
KKRS,KKR Group Finance Co. IX LLC 4.625% Subordinated Notes due 2061,$19.94,-0.07,-0.35%,17695551187.00,United States,2021,21362,,
KLAC,KLA Corporation Common Stock,$673.07,6.91,1.037%,90477449558.00,United States,1980,954807,Technology,Electronic Components
KLC,KinderCare Learning Companies Inc. Common Stock,$28.36,-0.10,-0.351%,3243422284.00,,2024,163575,Consumer Discretionary,Other Consumer Services
KLG,WK Kellogg Co Common Stock,$17.05,-0.28,-1.616%,1464619535.00,United States,2023,527343,Consumer Staples,Packaged Foods
KLIC,Kulicke and Soffa Industries Inc. Common Stock,$44.59,1.33,3.074%,2430568706.00,Singapore,,389686,Technology,Semiconductors
KLTO,Klotho Neurosciences Inc. Common Stock,$0.48,-0.066,-12.088%,8270167.00,United States,2022,127570,Health Care,Biotechnology: Biological Products (No Diagnostic Substances)
KLTOW,Klotho Neurosciences Inc. Warrant,$0.0353,-0.0197,-35.818%,608202.00,United States,2022,12760,Health Care,Biotechnology: Biological Products (No Diagnostic Substances)
KLTR,Kaltura Inc. Common Stock,$1.31,-0.01,-0.758%,195180754.00,United States,2021,56582,Technology,Computer Software: Prepackaged Software
KLXE,KLX Energy Services Holdings Inc. Common Stock,$4.51,0.12,2.733%,76058584.00,United States,,44914,Energy,Oilfield Services/Equipment
KMB,Kimberly-Clark Corporation Common Stock,$135.52,-1.49,-1.088%,45193928534.00,United States,,2273903,Consumer Discretionary,Containers/Packaging
KMDA,Kamada Ltd. Ordinary Shares,$5.28,-0.035,-0.659%,236755200.00,Israel,2013,8249,Health Care,Biotechnology: Pharmaceutical Preparations
KMI,Kinder Morgan Inc. Common Stock,$24.95,-0.04,-0.16%,55429921618.00,United States,2011,16549390,Utilities,Natural Gas Distribution
KMPB,Kemper Corporation 5.875% Fixed-Rate Reset Junior Subordinated Debentures due 2062,$23.29,-0.05,-0.214%,1500497680.00,United States,2022,9802,Finance,Property-Casualty Insurers
KMPR,Kemper Corporation,$63.02,-1.01,-1.577%,4060170193.00,United States,,286563,Finance,Property-Casualty Insurers
KMT,Kennametal Inc. Common Stock,$25.01,-0.20,-0.793%,1948298783.00,United States,,951055,Industrials,Industrial Machinery/Components
KMX,CarMax Inc,$72.00,-0.58,-0.799%,11154552552.00,United States,,1150037,Consumer Discretionary,Retail-Auto Dealers and Gas Stations
KN,Knowles Corporation Common Stock,$17.66,0.44,2.555%,1561625818.00,United States,2014,661067,Consumer Staples,Consumer Electronics/Appliances
KNDI,Kandi Technologies Group Inc. Ordinary Shares,$1.40,0.02,1.449%,122301528.00,China,,101681,Consumer Discretionary,Auto Manufacturing
KNF,Knife Riv Holding Co. Common Stock,$93.45,0.80,0.863%,5290457282.00,United States,2023,249583,Industrials,Mining & Quarrying of Nonmetallic Minerals (No Fuels)
KNOP,KNOT Offshore Partners LP Common Units representing Limited Partner Interests,$6.35,0.06,0.954%,216186264.00,United Kingdom,2013,49041,Consumer Discretionary,Marine Transportation
KNSA,Kiniksa Pharmaceuticals International plc Class A Ordinary Shares,$27.44,0.52,1.932%,1954927457.00,United States,2018,204259,Health Care,Biotechnology: Pharmaceutical Preparations
KNSL,Kinsale Capital Group Inc. Common Stock,$434.15,-24.27,-5.294%,10109800545.00,United States,,606687,Finance,Property-Casualty Insurers
KNTK,Kinetik Holdings Inc. Class A Common Stock,$49.64,-1.94,-3.761%,7819238097.00,United States,2022,1233498,Utilities,Natural Gas Distribution
KNW,Know Labs Inc. Common Stock,$0.2128,0.0138,6.935%,22552544.00,,2022,1137804,Industrials,Industrial Machinery/Components
KNX,Knight-Swift Transportation Holdings Inc.,$52.55,0.61,1.174%,8505953200.00,United States,2017,1698619,Industrials,Trucking Freight/Courier Services
KO,Coca-Cola Company (The) Common Stock,$66.92,-0.38,-0.565%,288416376598.00,United States,,11134141,Consumer Staples,Beverages (Production/Distribution)
KOD,Kodiak Sciences Inc Common Stock,$3.74,0.31,9.038%,196779086.00,United States,2018,424486,Health Care,Biotechnology: Biological Products (No Diagnostic Substances)
KODK,Eastman Kodak Company Common New,$4.68,-0.04,-0.847%,375804000.00,United States,,359139,Consumer Discretionary,Industrial Machinery/Components
KOF,Coca Cola Femsa S.A.B. de C.V.  American Depositary Shares each representing 10 Units (each Unit consists of 3 Series B Shares and 5 Series L Shares),$85.86,0.95,1.119%,18037745784.00,Mexico,1993,173520,Consumer Staples,Beverages (Production/Distribution)
KOP,Koppers Holdings Inc. Common Stock,$34.33,-0.42,-1.209%,704427432.00,United States,2006,58796,Basic Materials,Forest Products
KOPN,Kopin Corporation Common Stock,$0.7776,0.0126,1.647%,94064797.00,United States,1992,394090,Technology,Semiconductors
KORE,KORE Group Holdings Inc. Common Stock,$2.13,-0.0586,-2.678%,38537630.00,United States,,1388,Telecommunications,Telecommunications Equipment
KOS,Kosmos Energy Ltd. Common Shares (DE),$4.17,0.15,3.731%,1967475518.00,Bermuda,2011,8920541,Energy,Oil & Gas Production
KOSS,Koss Corporation Common Stock,$7.26,0.00,0.00%,67516512.00,United States,,134413,Consumer Staples,Consumer Electronics/Appliances
KPLT,Katapult Holdings Inc. Common Stock,$8.61,-0.31,-3.475%,35894393.00,United States,2019,17440,Consumer Discretionary,Diversified Commercial Services
KPLTW,Katapult Holdings Inc. Warrant,$0.0057,-0.0012,-17.391%,23763.00,United States,2019,19594,Consumer Discretionary,Diversified Commercial Services
KPRX,Kiora Pharmaceuticals Inc.  Common Stock,$3.64,0.0201,0.555%,10812784.00,United States,,13551,Health Care,Biotechnology: Pharmaceutical Preparations
KPTI,Karyopharm Therapeutics Inc. Common Stock,$0.8271,0.0111,1.36%,103125873.00,United States,2013,266645,Health Care,Biotechnology: Pharmaceutical Preparations
KR,Kroger Company (The) Common Stock,$57.37,0.68,1.20%,41506407769.00,United States,,4249616,Consumer Staples,Food Chains
KRC,Kilroy Realty Corporation Common Stock,$41.42,-0.26,-0.624%,4862096268.00,United States,1997,1141149,Real Estate,Real Estate Investment Trusts
KREF,KKR Real Estate Finance Trust Inc. Common Stock,$11.69,-0.26,-2.176%,813304290.00,United States,2017,472411,Real Estate,Real Estate Investment Trusts
KREF^A,KKR Real Estate Finance Trust Inc. 6.50% Series A Cumulative Redeemable Preferred Stock,$21.62,0.17,0.793%,,United States,,10780,,
KRG,Kite Realty Group Trust Common Stock,$25.67,-0.39,-1.497%,5638816953.00,United States,2004,985312,Real Estate,Real Estate Investment Trusts
KRKR,36Kr Holdings Inc. American Depositary Shares,$4.21,-0.0768,-1.792%,8210700.00,China,2019,6259,Consumer Discretionary,Business Services
KRMD,KORU Medical Systems Inc. Common Stock (DE),$2.53,0.01,0.397%,116013980.00,United States,,51904,Health Care,Medical/Dental Instruments
KRNT,Kornit Digital Ltd. Ordinary Shares,$23.70,0.18,0.765%,1130955302.00,Israel,2015,589838,Industrials,Industrial Machinery/Components
KRNY,Kearny Financial Corp Common Stock,$6.78,-0.25,-3.556%,437850251.00,United States,2005,288255,Finance,Savings Institutions
KRO,Kronos Worldwide Inc Common Stock,$11.65,-0.05,-0.427%,1340173081.00,United States,,103695,Industrials,Major Chemicals
KRON,Kronos Bio Inc. Common Stock,$0.97,0.019,1.998%,58485772.00,United States,2020,19788,Health Care,Biotechnology: Pharmaceutical Preparations
KROS,Keros Therapeutics Inc. Common Stock,$60.76,1.20,2.015%,2279842614.00,United States,2020,258241,Health Care,Biotechnology: Pharmaceutical Preparations
KRP,Kimbell Royalty Partners Common Units Representing Limited Partner Interests,$16.02,-0.17,-1.05%,1529810211.00,United States,2017,342171,Energy,Oil & Gas Production
KRRO,Korro Bio Inc. Common Stock,$68.15,0.02,0.029%,633714242.00,United States,2019,90890,Health Care,Biotechnology: Pharmaceutical Preparations
KRT,Karat Packaging Inc. Common Stock,$26.38,-0.45,-1.677%,527986863.00,United States,2021,16890,Industrials,Plastic Products
KRUS,Kura Sushi USA Inc. Class A Common Stock,$94.32,-0.18,-0.19%,1060623024.00,United States,2019,61955,Consumer Discretionary,Restaurants
KRYS,Krystal Biotech Inc. Common Stock,$175.51,0.535,0.306%,5042393525.00,United States,2017,129171,Health Care,Biotechnology: Biological Products (No Diagnostic Substances)
KSCP,Knightscope Inc. Class A Common Stock,$14.98,1.37,10.066%,45785142.00,United States,2022,292913,Telecommunications,Telecommunications Equipment
KSM,DWS Strategic Municipal Income Trust,$10.07,0.02,0.199%,0.00,United States,1989,5285,Finance,Trusts Except Educational Religious and Charitable
KSPI,Joint Stock Company Kaspi.kz American Depository Shares,$108.44,-1.78,-1.615%,20531320945.00,Kazakhstan,2024,201643,,
KSS,Kohl's Corporation Common Stock,$19.04,-0.05,-0.262%,2117980183.00,United States,1992,4373788,Consumer Discretionary,Department/Specialty Retail Stores
KT,KT Corporation Common Stock,$15.80,0.09,0.573%,7786664135.00,South Korea,,499179,Telecommunications,Telecommunications Equipment
KTB,Kontoor Brands Inc. Common Stock ,$76.88,0.27,0.352%,4281083481.00,United States,2019,258844,Consumer Discretionary,Apparel
KTCC,Key Tronic Corporation Common Stock,$5.93,-0.03,-0.503%,63817895.00,United States,1983,4626,Technology,Electrical Products
KTF,DWS Municipal Income Trust,$9.75,-0.03,-0.307%,385134146.00,United States,1988,106709,Finance,Finance Companies
KTH,Structures Products Cp 8% CorTS Issued by Peco Energy Cap Tr II Preferred Stock,$29.805,-0.245,-0.815%,0.00,United States,,5686,Finance,Finance: Consumer Services
KTN,Structured Products Corp 8.205% CorTS 8.205% Corporate Backed Trust Securities (CorTS),$27.18,-0.11,-0.403%,0.00,United States,,2371,Finance,Finance: Consumer Services
KTOS,Kratos Defense & Security Solutions Inc. Common Stock,$23.95,0.02,0.084%,3616433235.00,United States,,523426,Industrials,Military/Government/Technical
KTTA,Pasithea Therapeutics Corp. Common Stock,$3.70,-0.34,-8.416%,3863100.00,United States,2021,35040,Health Care,Biotechnology: Pharmaceutical Preparations
KTTAW,Pasithea Therapeutics Corp. Warrant,$0.028,0.0077,37.931%,29234.00,United States,2021,1000,Health Care,Biotechnology: Pharmaceutical Preparations
KUKE,Kuke Music Holding Limited American Depositary Shares each representing one Ordinary Share,$0.568,0.058,11.373%,18886979.00,,2021,177135,Real Estate,Other Consumer Services
KULR,KULR Technology Group Inc. Common Stock,$0.281,-0.0078,-2.701%,54230083.00,United States,,1843570,Technology,Electrical Products
KURA,Kura Oncology Inc. Common Stock,$17.51,-0.27,-1.519%,1341870025.00,United States,,583434,Health Care,Biotechnology: Pharmaceutical Preparations
KVAC,Keen Vision Acquisition Corporation Ordinary Shares,$10.80,0.03,0.279%,0.00,United States,2023,9998,,
KVACU,Keen Vision Acquisition Corporation Units,$10.61,0.00,0.00%,0.00,United States,2023,31,,
KVACW,Keen Vision Acquisition Corporation Warrant,$0.05,0.00,0.00%,0.00,United States,2023,13873,,
KVHI,KVH Industries Inc. Common Stock,$4.65,-0.14,-2.923%,91670500.00,United States,1996,22674,Technology,Radio And Television Broadcasting And Communications Equipment
KVUE,Kenvue Inc. Common Stock,$22.64,-0.33,-1.437%,43359388940.00,United States,2023,8395720,Consumer Discretionary,Specialty Chemicals
KVYO,Klaviyo Inc. Series A Common Stock,$39.04,0.34,0.879%,10410904004.00,United States,2023,974848,Technology,Computer Software: Prepackaged Software
KW,Kennedy-Wilson Holdings Inc. Common Stock,$10.94,-0.26,-2.321%,1503286438.00,United States,,508456,Finance,Real Estate
KWE,KWESST Micro Systems Inc. Common Stock,$1.76,0.26,17.333%,2779346.00,Canada,,2624676,Technology,Computer Software: Prepackaged Software
KWESW,KWESST Micro Systems Inc. Warrant,$0.0268,0.00,0.00%,42322.00,Canada,,150,Technology,Computer Software: Prepackaged Software
KWR,Quaker Houghton Common Stock,$153.87,-1.12,-0.723%,2756143290.00,United States,,61295,Industrials,Major Chemicals
KXIN,Kaixin Holdings Ordinary Shares,$5.37,-1.0199,-15.961%,320320500.00,China,2017,1152913,Consumer Discretionary,Retail-Auto Dealers and Gas Stations
KYMR,Kymera Therapeutics Inc. Common Stock,$47.99,-0.74,-1.519%,2963538132.00,United States,2020,430325,Health Care,Biotechnology: Biological Products (No Diagnostic Substances)
KYN,Kayne Anderson Energy Infrastructure Fund Inc.,$11.73,0.01,0.085%,1596822847.00,United States,2004,196786,Finance,Finance/Investors Services
KYTX,Kyverna Therapeutics Inc. Common Stock,$5.12,0.15,3.018%,220911882.00,United States,2024,198489,Health Care,Biotechnology: Biological Products (No Diagnostic Substances)
KZIA,Kazia Therapeutics Limited American Depositary Shares,$0.52,-0.008,-1.515%,15490800.00,Australia,,448585,Health Care,Biotechnology: Pharmaceutical Preparations
KZR,Kezar Life Sciences Inc. Common Stock,$0.7857,-0.0161,-2.008%,57326416.00,United States,2018,132943,Health Care,Biotechnology: Pharmaceutical Preparations
L,Loews Corporation Common Stock,$79.57,-1.52,-1.874%,17466928860.00,United States,,571338,Finance,Property-Casualty Insurers
LAAC,Lithium Americas (Argentina) Corp. Common Shares,$3.50,-0.14,-3.846%,564550000.00,Canada,2023,2132861,,
LAB,Standard BioTools Inc. Common Stock,$1.68,-0.05,-2.89%,623539511.00,United States,2011,1545365,Industrials,Biotechnology: Laboratory Analytical Instruments
LAC,Lithium Americas Corp. Common Shares,$3.68,0.27,7.918%,593584000.00,Canada,2023,14735462,Basic Materials,Metal Mining
LAD,Lithia Motors Inc. Common Stock,$333.10,-2.22,-0.662%,8907052363.00,United States,,325155,Consumer Discretionary,Retail-Auto Dealers and Gas Stations
LADR,Ladder Capital Corp Class A Common Stock,$11.28,-0.10,-0.879%,1442329687.00,United States,2014,775915,Real Estate,Real Estate Investment Trusts
LAES,SEALSQ Corp Ordinary Shares,$0.3991,-0.0018,-0.449%,9330958.00,Switzerland,,377781,Technology,Semiconductors
LAKE,Lakeland Industries Inc. Common Stock,$20.25,-0.60,-2.878%,149781231.00,United States,1986,46568,Health Care,Industrial Specialties
LAMR,Lamar Advertising Company Class A Common Stock,$134.69,-1.06,-0.781%,13779006949.00,United States,1996,192297,Real Estate,Real Estate Investment Trusts
LANC,Lancaster Colony Corporation Common Stock,$177.21,0.73,0.414%,4878059670.00,United States,,113692,Consumer Staples,Packaged Foods
LAND,Gladstone Land Corporation Common Stock,$13.20,-0.09,-0.677%,473067434.00,United States,1993,157165,Real Estate,Real Estate Investment Trusts
LANDM,Gladstone Land Corporation 5.00% Series D Cumulative Term Preferred Stock,$24.5414,0.0094,0.038%,879525540.00,United States,,360,Real Estate,Real Estate Investment Trusts
LANDO,Gladstone Land Corporation 6.00% Series B Cumulative Redeemable Preferred Stock,$21.8599,0.1999,0.923%,783424758.00,United States,,6703,Real Estate,Real Estate Investment Trusts
LANDP,Gladstone Land Corporation 6.00% Series C Cumulative Redeemable Preferred Stock,$20.84,-0.16,-0.762%,746873131.00,United States,,31343,Real Estate,Real Estate Investment Trusts
LANV,Lanvin Group Holdings Limited Ordinary Shares,$1.85,-0.11,-5.612%,242296480.00,Cayman Islands,1996,1014,Finance,Blank Checks
LARK,Landmark Bancorp Inc. Common Stock,$20.245,-0.205,-1.002%,111396250.00,United States,,195,Finance,Major Banks
LASE,Laser Photonics Corporation Common Stock,$5.86,-0.03,-0.509%,71904702.00,United States,2022,685013,Miscellaneous,Industrial Machinery/Components
LASR,nLIGHT Inc. Common Stock,$10.33,0.03,0.291%,497138078.00,United States,2018,138890,Technology,Semiconductors
LATG,Chenghe Acquisition I Co. Class A Ordinary Shares,$11.66,0.00,0.00%,189475000.00,Mexico,2022,1000,Finance,Blank Checks
LAUR,Laureate Education Inc. Common Stock,$15.30,-0.08,-0.52%,2333950250.00,United States,2017,252606,Real Estate,Other Consumer Services
LAW,CS Disco Inc. Common Stock,$5.82,-0.02,-0.342%,346176149.00,United States,2021,51533,Technology,Computer Software: Prepackaged Software
LAZ,Lazard Inc. Common Stock,$51.12,0.24,0.472%,4609490400.00,Bermuda,2005,505008,Finance,Investment Managers
LAZR,Luminar Technologies Inc.  Class A Common Stock,$0.8149,0.0157,1.964%,402365462.00,United States,2019,39273242,Consumer Discretionary,Auto Parts:O.E.M.
LB,LandBridge Company LLC Class A Shares Representing Limited Liability Company Interests,$52.23,-1.73,-3.206%,3820708225.00,,2024,355378,Energy,Oil & Gas Production
LBGJ,Li Bang International Corporation Inc. Ordinary Shares,$3.81,-0.12,-3.053%,0.00,China,2024,377086,,
LBPH,Longboard Pharmaceuticals Inc. Common Stock,$59.60,0.03,0.05%,2318411452.00,United States,2021,1091508,Health Care,Biotechnology: Pharmaceutical Preparations
LBRDA,Liberty Broadband Corporation Class A Common Stock,$81.42,1.10,1.37%,11630681636.00,United States,,75773,Telecommunications,Cable & Other Pay Television Services
LBRDK,Liberty Broadband Corporation Class C Common Stock,$81.89,0.98,1.211%,11697820181.00,United States,,501495,Telecommunications,Cable & Other Pay Television Services
LBRDP,Liberty Broadband Corporation Series A Cumulative Redeemable Preferred Stock,$23.85,0.07,0.294%,3406924061.00,United States,,9038,Telecommunications,Cable & Other Pay Television Services
LBRT,Liberty Energy Inc. Class A common stock,$17.91,0.17,0.958%,2926774918.00,United States,2018,2635432,Energy,Oilfield Services/Equipment
