Symbol,Name,Last Sale,Net Change,% Change,Market Cap,Country,IPO Year,Volume,Sector,Industry
DHAI,DIH Holdings US Inc. Class A Common Stock,$1.50,0.01,0.671%,60817403.00,United States,2024,39008,Health Care,Medical/Dental Instruments
DHAIW,DIH Holding US Inc. Warrants,$0.0476,0.0076,19.00%,1929939.00,United States,2024,7974,Health Care,Medical/Dental Instruments
DHC,Diversified Healthcare Trust Common Shares of Beneficial Interest,$3.40,-0.06,-1.734%,817953677.00,United States,,427468,Real Estate,Real Estate Investment Trusts
DHCNI,Diversified Healthcare Trust 5.625% Senior Notes due 2042,$15.265,-0.375,-2.398%,3672371437.00,United States,,17377,Real Estate,Real Estate Investment Trusts
DHCNL,Diversified Healthcare Trust 6.25% Senior Notes Due 2046,$16.35,-0.31,-1.861%,3933394890.00,United States,,18662,Real Estate,Real Estate Investment Trusts
DHF,BNY Mellon High Yield Strategies Fund Common Stock,$2.61,0.01,0.385%,0.00,United States,1998,184244,Finance,Finance Companies
DHI,D.R. Horton Inc. Common Stock,$179.24,-3.46,-1.894%,58439426807.00,United States,,1962712,Consumer Discretionary,Homebuilding
DHIL,Diamond Hill Investment Group Inc. Class A Common Stock,$153.43,-1.85,-1.191%,422089459.00,United States,,9568,Finance,Investment Managers
DHR,Danaher Corporation Common Stock,$245.39,-2.61,-1.052%,177239096850.00,United States,,3222545,Industrials,Industrial Machinery/Components
DHT,DHT Holdings Inc.,$10.56,0.06,0.571%,1700155164.00,Jersey,2005,1088212,Consumer Discretionary,Marine Transportation
DHX,DHI Group Inc. Common Stock,$1.70,-0.06,-3.409%,82286569.00,United States,2007,48286,Consumer Discretionary,Business Services
DHY,Credit Suisse High Yield Bond Fund Common Stock,$2.18,-0.02,-0.909%,0.00,United States,1998,226701,Finance,Finance/Investors Services
DIAX,Nuveen Dow 30SM Dynamic Overwrite Fund Common Shares of Beneficial Interest,$14.71,-0.07,-0.474%,0.00,,2014,51397,Finance,Finance Companies
DIBS,1stdibs.com Inc. Common Stock,$4.19,0.02,0.48%,166314248.00,United States,2021,103409,Consumer Discretionary,Catalog/Specialty Distribution
DIN,Dine Brands Global Inc. Common Stock,$29.95,-0.50,-1.642%,458205499.00,United States,,410949,Consumer Discretionary,Restaurants
DINO,HF Sinclair Corporation Common Stock,$43.01,0.10,0.233%,8207026869.00,United States,1960,1459150,Energy,Natural Gas Distribution
DIOD,Diodes Incorporated Common Stock,$64.66,0.12,0.186%,2995800027.00,United States,,232647,Technology,Semiconductors
DIS,Walt Disney Company (The) Common Stock,$95.03,-0.37,-0.388%,172345208721.00,United States,,6631409,Consumer Discretionary,Services-Misc. Amusement & Recreation
DIST,Distoken Acquisition Corporation Ordinary Shares,$10.93,0.02,0.183%,0.00,China,2023,6588,Finance,Blank Checks
DISTW,Distoken Acquisition Corporation Warrant,$0.0176,0.0036,25.714%,0.00,China,2023,26250,Finance,Blank Checks
DIT,AMCON Distributing Company Common Stock,$135.00,-1.00,-0.735%,85098870.00,United States,1999,72,Consumer Discretionary,Food Distributors
DJCO,Daily Journal Corp. (S.C.) Common Stock,$481.60,-5.40,-1.109%,663368362.00,United States,,14315,Consumer Discretionary,Newspapers/Magazines
DJT,Trump Media & Technology Group Corp. Common Stock,$38.95,4.00,11.445%,7584179319.00,United States,2024,56238961,Technology,Computer Software: Programming Data Processing
DJTWW,Trump Media & Technology Group Corp. Warrants,$27.72,2.30,9.048%,5397521200.00,United States,2021,647061,Technology,Computer Software: Programming Data Processing
DK,Delek US Holdings Inc. Common Stock,$17.01,0.29,1.734%,1097802011.00,United States,2017,678189,Energy,Integrated oil Companies
DKL,Delek Logistics Partners L.P. Common Units representing Limited Partner Interests,$38.96,-0.08,-0.205%,1840078891.00,United States,2012,103446,Energy,Natural Gas Distribution
DKNG,DraftKings Inc. Class A Common Stock,$36.47,-0.31,-0.843%,17707293870.00,United States,2019,8744212,Consumer Discretionary,Services-Misc. Amusement & Recreation
DKS,Dick's Sporting Goods Inc Common Stock,$204.37,-0.15,-0.073%,16638318200.00,United States,2002,495322,Consumer Discretionary,Other Specialty Stores
DLB,Dolby Laboratories Common Stock,$72.79,0.27,0.372%,6940353478.00,United States,2005,178344,Miscellaneous,Multi-Sector Companies
DLHC,DLH Holdings Corp.,$8.25,0.05,0.61%,117008851.00,United States,,50334,Consumer Discretionary,Professional Services
DLNG,Dynagas LNG Partners LP Common Units,$3.87,-0.01,-0.258%,142562182.00,Greece,,11832,Consumer Discretionary,Marine Transportation
DLNG^A,Dynagas LNG Partners LP 9.00% Series A Cumulative Redeemable Preferred Units,$25.7068,0.00,0.00%,,Greece,,243,,
DLNG^B,Dynagas LNG Partners LP 8.75% Series B Fixed to Floating Rate Cumulative Redeemable Perpetual Preferred Units liquidation preference $25.00 per Uni,$26.5168,-0.3432,-1.278%,,Greece,,8607,,
DLO,DLocal Limited Class A Common Shares,$8.83,0.08,0.914%,2613606402.00,Uruguay,2021,437535,Consumer Discretionary,Business Services
DLPN,Dolphin Entertainment Inc. Common Stock,$1.30,0.0107,0.83%,14440642.00,United States,,15429,Consumer Discretionary,Other Consumer Services
DLR,Digital Realty Trust Inc. Common Stock,$181.01,15.88,9.617%,59264673436.00,United States,2004,6093027,Real Estate,Real Estate Investment Trusts
DLR^J,Digital Realty Trust Inc. 5.250% Series J Cumulative Redeemable Preferred Stock,$23.83,0.02,0.084%,,United States,,13156,,
DLR^K,Digital Realty Trust Inc. 5.850% Series K Cumulative Redeemable Preferred Stock par value $0.01 per share,$24.88,-0.08,-0.321%,,United States,,10541,,
DLR^L,Digital Realty Trust Inc. 5.200% Series L Cumulative Redeemable Preferred Stock,$23.74,0.11,0.466%,,United States,,12362,,
DLTH,Duluth Holdings Inc. Class B Common Stock,$3.74,-0.15,-3.856%,131032400.00,United States,2015,53467,Consumer Discretionary,Clothing/Shoe/Accessory Stores
DLTR,Dollar Tree Inc. Common Stock,$66.45,-0.50,-0.747%,14286226308.00,United States,1995,2262432,Consumer Discretionary,Department/Specialty Retail Stores
DLX,Deluxe Corporation Common Stock,$18.62,-0.32,-1.69%,823211390.00,United States,,149024,Consumer Discretionary,Publishing
DLY,DoubleLine Yield Opportunities Fund Common Shares of Beneficial Interest,$15.84,-0.04,-0.252%,759461139.00,United States,2020,191529,Finance,Investment Managers
DM,Desktop Metal Inc. Class A Common Stock,$4.90,0.03,0.616%,162844669.00,United States,2019,114553,Technology,Industrial Machinery/Components
DMA,Destra Multi-Alternative Fund Common Stock,$8.76,-0.09,-1.017%,0.00,,2022,23121,Finance,Trusts Except Educational Religious and Charitable
DMAC,DiaMedica Therapeutics Inc. Common Stock,$4.39,0.055,1.269%,187662982.00,United States,2018,40098,Health Care,Biotechnology: Pharmaceutical Preparations
DMB,BNY Mellon Municipal Bond Infrastructure Fund Inc. Common Stock,$10.68,-0.02,-0.187%,0.00,,2013,53224,Finance,Trusts Except Educational Religious and Charitable
DMF,BNY Mellon Municipal Income Inc. Common Stock,$7.145,0.005,0.07%,445068152.00,United States,1988,30262,Finance,Finance/Investors Services
DMLP,Dorchester Minerals L.P. Common Units Representing Limited Partnership Interests,$32.59,-0.40,-1.212%,1306487865.00,United States,,167350,Energy,Oil & Gas Production
DMO,Western Asset Mortgage Opportunity Fund Inc. Common Stock,$12.09,0.015,0.124%,0.00,United States,2010,30096,Finance,Trusts Except Educational Religious and Charitable
DMRC,Digimarc Corporation Common Stock,$32.12,1.09,3.513%,688030475.00,United States,,58521,Technology,EDP Services
DMYY,dMY Squared Technology Group Inc. Class A Common Stock,$10.66,0.07,0.661%,0.00,,2022,404,Finance,Blank Checks
DNA,Ginkgo Bioworks Holdings Inc. Class A Common Stock,$8.16,0.22,2.771%,453495142.00,United States,2021,890743,Health Care,Biotechnology: Biological Products (No Diagnostic Substances)
DNB,Dun & Bradstreet Holdings Inc. Common Stock,$10.89,0.11,1.02%,4811051010.00,United States,2020,3101871,Finance,Finance: Consumer Services
DNLI,Denali Therapeutics Inc. Common Stock,$26.15,-0.29,-1.097%,3743771654.00,United States,2017,410053,Health Care,Biotechnology: Biological Products (No Diagnostic Substances)
DNMR,Danimer Scientific Inc. Common Stock,$0.3942,-0.0013,-0.329%,47371057.00,United States,2020,273821,Industrials,Major Chemicals
DNN,Denison Mines Corp Ordinary Shares (Canada),$2.19,-0.01,-0.455%,1954290153.00,Canada,,13827314,Basic Materials,Other Metals and Minerals
DNOW,DNOW Inc. Common Stock,$11.92,0.07,0.591%,1269122340.00,United States,2014,713020,Industrials,Metal Fabrications
DNP,DNP Select Income Fund Inc. Common Stock,$9.64,-0.09,-0.925%,0.00,United States,1987,364105,Finance,Investment Managers
DNTH,Dianthus Therapeutics Inc. Common Stock,$27.71,-0.23,-0.823%,813408207.00,United States,2018,106163,Health Care,Biotechnology: Pharmaceutical Preparations
DNUT,Krispy Kreme Inc. Common Stock,$11.52,-0.12,-1.031%,1953792000.00,United States,2021,856146,Consumer Staples,Food Chains
DOC,Healthpeak Properties Inc. Common Stock,$22.29,-0.71,-3.087%,15587205618.00,United States,,8802302,Real Estate,Real Estate Investment Trusts
DOCN,DigitalOcean Holdings Inc. Common Stock,$41.04,-0.18,-0.437%,3778238680.00,United States,2021,542428,Technology,Computer Software: Programming Data Processing
DOCS,Doximity Inc. Class A Common Stock,$41.25,-0.22,-0.531%,7658499750.00,United States,2021,870259,Technology,EDP Services
DOCU,DocuSign Inc. Common Stock,$68.99,-1.59,-2.253%,14003087470.00,United States,1989,2563433,Technology,Computer Software: Prepackaged Software
DOGZ,Dogness (International) Corporation Class A Common Stock,$56.84,-0.06,-0.105%,723610601.00,China,2017,77838,Consumer Discretionary,Miscellaneous manufacturing industries
DOLE,Dole plc Ordinary Shares,$16.09,-0.09,-0.556%,1527410490.00,Ireland,2021,400571,Consumer Staples,Farming/Seeds/Milling
DOMH,Dominari Holdings Inc. Common Stock,$1.78,-0.0362,-1.993%,11171526.00,United States,,9196,Health Care,Biotechnology: Pharmaceutical Preparations
DOMO,Domo Inc. Class B Common Stock,$8.09,0.42,5.476%,312523706.00,United States,2018,324499,Technology,Computer Software: Prepackaged Software
DOOO,BRP Inc. (Recreational Products) Common Subordinate Voting Shares,$50.68,-0.32,-0.627%,3699769589.00,Canada,,75117,Consumer Discretionary,Industrial Specialties
DORM,Dorman Products Inc. Common Stock,$114.91,0.76,0.666%,3513061499.00,United States,,95197,Consumer Discretionary,Auto Parts:O.E.M.
DOUG,Douglas Elliman Inc. Common Stock,$1.81,-0.01,-0.549%,166217035.00,United States,2021,473155,Finance,Real Estate
DOV,Dover Corporation Common Stock,$186.98,2.20,1.191%,25701825601.00,United States,,1238411,Industrials,Industrial Machinery/Components
DOW,Dow Inc. Common Stock ,$49.70,-1.29,-2.53%,34835775092.00,United States,2019,5886707,Industrials,Major Chemicals
DOX,Amdocs Limited Ordinary Shares,$88.87,-0.87,-0.969%,10428700675.00,Guernsey,,242979,Technology,EDP Services
DOYU,DouYu International Holdings Limited ADS,$9.39,0.46,5.151%,297058040.00,China,2019,135281,Technology,Computer Software: Programming Data Processing
DPCS,DP Cap Acquisition Corp I Class A Ordinary Shares,$11.48,-0.05,-0.434%,0.00,United States,2021,200,Finance,Blank Checks
DPCSW,DP Cap Acquisition Corp I Warrants,$0.0132,-0.0107,-44.77%,0.00,United States,2021,191,Finance,Blank Checks
DPG,Duff & Phelps Utility and Infrastructure Fund Inc.,$11.59,-0.06,-0.515%,0.00,United States,2011,126291,Finance,Trusts Except Educational Religious and Charitable
DPRO,Draganfly Inc. Common Shares,$2.66,-0.04,-1.481%,9274510.00,Canada,,43810,Industrials,Aerospace
DPZ,Domino's Pizza Inc Common Stock,$413.81,-1.30,-0.313%,14289677816.00,United States,2004,497101,Consumer Discretionary,Food Distributors
DQ,DAQO New Energy Corp. American Depositary Shares each representing five ordinary shares,$25.54,3.54,16.091%,1685830299.00,China,2010,4485459,Technology,Semiconductors
DRCT,Direct Digital Holdings Inc. Class A Common Stock,$2.99,0.27,9.926%,43842965.00,United States,2022,77417,Consumer Discretionary,Advertising
DRD,DRDGOLD Limited American Depositary Shares,$12.04,-0.29,-2.352%,1040964807.00,South Africa,,294391,Basic Materials,Precious Metals
DRH,Diamondrock Hospitality Company Common Stock,$8.78,-0.07,-0.791%,1819721816.00,United States,2005,1028732,Real Estate,Real Estate Investment Trusts
DRH^A,Diamondrock Hospitality Company 8.250% Series A Cumulative Redeemable Preferred Stock,$25.73,-0.12,-0.464%,,United States,,3121,,
DRI,Darden Restaurants Inc. Common Stock,$159.92,-2.65,-1.63%,18790676122.00,United States,,691285,Consumer Discretionary,Restaurants
DRIO,DarioHealth Corp. Common Stock,$0.97,0.035,3.743%,29127432.00,Israel,,30444,Health Care,Medical/Dental Instruments
DRMA,Dermata Therapeutics Inc. Common Stock,$1.49,0.11,7.971%,1960812.00,United States,2021,235069,Health Care,Biotechnology: Pharmaceutical Preparations
DRMAW,Dermata Therapeutics Inc. Warrant,$0.0083,-0.0015,-15.306%,10923.00,United States,2021,16500,Health Care,Biotechnology: Pharmaceutical Preparations
DRRX,DURECT Corporation Common Stock,$1.43,-0.02,-1.379%,44386315.00,United States,2000,72323,Health Care,Biotechnology: Pharmaceutical Preparations
DRS,Leonardo DRS Inc. Common Stock,$28.25,-0.11,-0.388%,7449604298.00,Israel,,367293,Industrials,Industrial Machinery/Components
DRTS,Alpha Tau Medical Ltd. Ordinary Shares,$2.20,-0.02,-0.901%,153275346.00,Israel,,7117,Health Care,Medical/Dental Instruments
DRTSW,Alpha Tau Medical Ltd. Warrant,$0.1942,0.016,8.979%,13530033.00,Israel,,61565,Health Care,Medical/Dental Instruments
DRUG,Bright Minds Biosciences Inc. Common Stock,$48.94,-0.56,-1.131%,218460183.00,Canada,,941922,Health Care,Biotechnology: Pharmaceutical Preparations
DRVN,Driven Brands Holdings Inc. Common Stock,$14.53,0.02,0.138%,2384109687.00,United States,2021,351015,Consumer Discretionary,Automotive Aftermarket
DSGN,Design Therapeutics Inc. Common Stock,$5.44,0.09,1.682%,308015656.00,United States,2021,66282,Health Care,Biotechnology: Pharmaceutical Preparations
DSGR,Distribution Solutions Group Inc. Common Stock,$39.33,0.26,0.665%,1838966969.00,United States,,29649,Consumer Discretionary,Industrial Specialties
DSGX,Descartes Systems Group Inc. (The) Common Stock,$104.17,-0.37,-0.354%,8904516706.00,Canada,,87968,Technology,Computer Software: Prepackaged Software
DSL,DoubleLine Income Solutions Fund Common Shares of Beneficial Interests,$12.51,-0.01,-0.08%,1275980318.00,United States,2013,314772,Finance,Trusts Except Educational Religious and Charitable
DSM,BNY Mellon Strategic Municipal Bond Fund Inc. Common Stock,$6.01,0.02,0.334%,0.00,United States,1989,48899,Finance,Investment Managers
DSP,Viant Technology Inc. Class A Common Stock,$11.43,0.16,1.42%,722365507.00,United States,2021,50634,Technology,Computer Software: Programming Data Processing
DSS,DSS Inc. Common Stock,$1.375,0.005,0.365%,9716812.00,United States,,18880,Consumer Discretionary,Containers/Packaging
DSU,Blackrock Debt Strategies Fund Inc. Common Stock,$10.805,-0.025,-0.231%,0.00,United States,1998,111678,Finance,Finance Companies
DSWL,Deswell Industries Inc. Common Shares,$2.5912,0.0112,0.434%,41291391.00,Macau,1995,2181,Industrials,Plastic Products
DSX,Diana Shipping inc. common stock,$2.27,-0.03,-1.304%,272315822.00,Greece,2005,204797,Consumer Discretionary,Marine Transportation
DSX^B,Diana Shipping Inc. Perpetual Preferred Shares Series B (Marshall Islands),$26.63,0.1559,0.589%,,Greece,,2708,,
DSY,Big Tree Cloud Holdings Limited Ordinary Shares,$3.97,0.18,4.749%,226609768.00,China,,88522,Consumer Discretionary,Containers/Packaging
DSYWW,Big Tree Cloud Holdings Limited Warrants,$0.0384,0.0018,4.918%,2191893.00,China,,3567,Consumer Discretionary,Containers/Packaging
DT,Dynatrace Inc. Common Stock,$54.07,-0.06,-0.111%,16107746276.00,United States,2019,1161368,Technology,Computer Software: Prepackaged Software
DTB,DTE Energy Company 2020 Series G 4.375% Junior Subordinated Debentures due 2080,$20.44,-0.02,-0.098%,4231490435.00,United States,2020,14015,Utilities,Electric Utilities: Central
DTC,Solo Brands Inc. Class A Common Stock,$1.25,-0.01,-0.794%,114537548.00,United States,2021,175949,Consumer Discretionary,Recreational Games/Products/Toys
DTCK,Davis Commodities Limited Ordinary Shares,$1.10,-0.0112,-1.008%,26950688.00,Singapore,2023,21856,Industrials,Farming/Seeds/Milling
DTE,DTE Energy Company Common Stock,$126.57,-3.20,-2.466%,26202531526.00,United States,,1276027,Utilities,Electric Utilities: Central
DTF,DTF Tax-Free Income 2028 Term Fund Inc. Common Stock,$11.20,-0.01,-0.089%,78731150.00,United States,1991,9731,Finance,Investment Managers
DTG,DTE Energy Company 2021 Series E 4.375% Junior Subordinated Debentures,$21.01,0.06,0.286%,4349491881.00,United States,2021,14029,Utilities,Electric Utilities: Central
DTI,Drilling Tools International Corporation Common Stock,$3.30,-0.01,-0.302%,114525497.00,United States,2021,36751,Industrials,Metal Fabrications
DTIL,Precision BioSciences Inc. Common Stock,$8.37,-0.11,-1.297%,60546571.00,United States,2019,53789,Health Care,Biotechnology: Biological Products (No Diagnostic Substances)
DTM,DT Midstream Inc. Common Stock ,$87.39,-0.56,-0.637%,8486589366.00,United States,2021,507939,Utilities,Natural Gas Distribution
DTSQ,DT Cloud Star Acquisition Corporation Ordinary Shares,$10.01,0.00,0.00%,0.00,United States,2024,5,,
DTSQR,DT Cloud Star Acquisition Corporation Right,$0.125,0.005,4.167%,0.00,United States,2024,250006,,
DTSQU,DT Cloud Star Acquisition Corporation Units,$10.13,0.00,0.00%,0.00,United States,2024,41,,
DTSS,Datasea Inc. Common Stock,$2.47,-0.07,-2.756%,12732302.00,China,,116928,Technology,Computer Software: Prepackaged Software
DTST,Data Storage Corporation Common Stock,$3.46,0.045,1.318%,24205544.00,United States,,27728,Technology,EDP Services
DTSTW,Data Storage Corporation Warrant,$0.4655,0.0187,4.185%,3256555.00,United States,,1000,Technology,EDP Services
DTW,DTE Energy Company 2017 Series E 5.25% Junior Subordinated Debentures due 2077,$24.06,-0.06,-0.249%,4980903125.00,United States,2017,21156,Utilities,Electric Utilities: Central
DUK,Duke Energy Corporation (Holding Company) Common Stock,$117.21,-1.81,-1.521%,90509761960.00,United States,,2406177,Utilities,Power Generation
DUK^A,Duke Energy Corporation Depositary Shares each representing a 1/1000th interest in a share of 5.75% Series A Cumulative Redeemable Perpetual Preferred Stock,$25.15,-0.07,-0.278%,,United States,,60720,,
DUKB,Duke Energy Corporation 5.625% Junior Subordinated Debentures due 2078,$24.98,-0.04,-0.16%,19289598616.00,United States,2018,16116,Utilities,Power Generation
DUO,Fangdd Network Group Ltd. Class A Ordinary Shares,$1.08,-0.03,-2.703%,6879600.00,China,2019,1802218,Finance,Real Estate
DUOL,Duolingo Inc. Class A Common Stock,$291.61,10.21,3.628%,12696334596.00,United States,2021,483730,Technology,Computer Software: Prepackaged Software
DUOT,Duos Technologies Group Inc. Common Stock,$4.22,0.07,1.687%,32451669.00,United States,,34702,Technology,Computer Software: Prepackaged Software
DV,DoubleVerify Holdings Inc. Common Stock,$17.35,0.54,3.212%,2950277471.00,United States,2021,2631446,Technology,Computer Software: Programming Data Processing
DVA,DaVita Inc. Common Stock,$156.99,-4.39,-2.72%,13171461000.00,United States,,854298,Health Care,Misc Health and Biotechnology Services
DVAX,Dynavax Technologies Corporation Common Stock,$10.71,-0.06,-0.557%,1403485342.00,United States,2004,1784651,Health Care,Biotechnology: Pharmaceutical Preparations
DVN,Devon Energy Corporation Common Stock,$39.19,-0.32,-0.81%,24540778000.00,United States,1985,9276787,Energy,Oil & Gas Production
DWSN,Dawson Geophysical Company Common Stock,$1.79,0.1102,6.56%,55323131.00,United States,,3939,Energy,Oil & Gas Production
DWTX,Dogwood Therapeutics Inc. Common Stock,$4.99,0.2399,5.05%,6648017.00,United States,2020,94500,Health Care,Biotechnology: Pharmaceutical Preparations
DX,Dynex Capital Inc. Common Stock,$12.41,-0.24,-1.897%,927123500.00,United States,,2829640,Real Estate,Real Estate Investment Trusts
DX^C,Dynex Capital Inc. 6.900% Series C Fixed-to-Floating Rate Cumulative Redeemable Preferred Stock,$25.23,-0.10,-0.395%,,United States,,2758,,
DXC,DXC Technology Company Common Stock ,$19.87,-0.07,-0.351%,3592758880.00,United States,,764115,Technology,EDP Services
DXCM,DexCom Inc. Common Stock,$73.44,-1.41,-1.884%,29429377955.00,United States,2005,14558640,Health Care,Medical/Dental Instruments
DXLG,Destination XL Group Inc. Common Stock,$2.66,-0.03,-1.115%,154965546.00,United States,,215633,Consumer Discretionary,Clothing/Shoe/Accessory Stores
DXPE,DXP Enterprises Inc. Common Stock,$48.51,-0.48,-0.98%,765910516.00,United States,,68229,Industrials,Industrial Machinery/Components
DXR,Daxor Corporation Common Stock,$8.905,-0.095,-1.056%,43100200.00,United States,,1588,Health Care,Medical/Dental Instruments
DXYZ,Destiny Tech100 Inc. Common Stock,$11.99,0.39,3.362%,0.00,,2024,266346,,
DY,Dycom Industries Inc. Common Stock,$192.06,-3.23,-1.654%,5589741705.00,United States,,200690,Industrials,Water Sewer Pipeline Comm & Power Line Construction
DYAI,Dyadic International Inc. Common Stock,$1.06,-0.048,-4.332%,31246297.00,United States,,11776,Health Care,Biotechnology: Biological Products (No Diagnostic Substances)
DYCQ,DT Cloud Acquisition Corporation Ordinary Shares,$10.40,0.05,0.483%,0.00,United Kingdom,2024,234,,
DYCQU,DT Cloud Acquisition Corporation Unit,$10.46,0.00,0.00%,0.00,United Kingdom,2024,9,,
DYN,Dyne Therapeutics Inc. Common Stock,$30.73,-0.37,-1.19%,3085316523.00,United States,2020,802932,Health Care,Biotechnology: Pharmaceutical Preparations
E,ENI S.p.A. Common Stock,$31.00,0.10,0.324%,52327037357.00,Italy,,155290,Energy,Oil & Gas Production
EA,Electronic Arts Inc. Common Stock,$145.20,0.17,0.117%,38361829981.00,United States,,1225716,Technology,Computer Software: Prepackaged Software
EAD,Allspring Income Opportunities Fund Common Shares,$6.91,0.03,0.436%,0.00,United States,2003,155816,Finance,Finance/Investors Services
EAF,GrafTech International Ltd. Common Stock,$1.97,0.15,8.242%,506619240.00,United States,2018,1627777,Energy,Industrial Machinery/Components
EAI,Entergy Arkansas LLC First Mortgage Bonds 4.875% Series Due September 1 2066,$22.85,-0.02,-0.087%,4886034831.00,United States,2016,19518,Utilities,Electric Utilities: Central
EARN,Ellington Credit Company Common Shares of Beneficial Interest,$6.86,-0.08,-1.153%,173743158.00,United States,2013,582623,Real Estate,Real Estate Investment Trusts
EAST,Eastside Distilling Inc. Common Stock,$0.585,-0.0326,-5.278%,1031641.00,United States,,40733,Consumer Staples,Beverages (Production/Distribution)
EAT,Brinker International Inc. Common Stock,$94.89,1.09,1.162%,4266077525.00,United States,,1269968,Consumer Discretionary,Restaurants
EB,Eventbrite Inc. Class A Common Stock,$3.00,0.11,3.806%,288303420.00,United States,2018,1439376,Technology,Computer Software: Programming Data Processing
EBAY,eBay Inc. Common Stock,$63.10,-0.49,-0.771%,30855900000.00,United States,1998,3117102,Consumer Discretionary,Business Services
EBC,Eastern Bankshares Inc. Common Stock,$15.92,-0.80,-4.785%,3433120920.00,United States,2020,1549827,Finance,Savings Institutions
EBF,Ennis Inc. Common Stock,$20.51,-0.24,-1.157%,533339046.00,United States,,129602,Consumer Discretionary,Office Equipment/Supplies/Services
EBMT,Eagle Bancorp Montana Inc. Common Stock,$16.50,-0.13,-0.782%,132276936.00,United States,2010,15786,Finance,Major Banks
EBON,Ebang International Holdings Inc. Class A Ordinary Shares,$5.73,-0.22,-3.697%,37496765.00,China,2020,9408,Technology,Semiconductors
EBR,Centrais Electricas Brasileiras S A American Depositary Shares (Each representing one Common Share),$6.64,-0.11,-1.63%,14912206832.00,Brazil,2016,547563,Utilities,Electric Utilities: Central
EBS,Emergent BioSolutions Inc. Common Stock,$8.93,-0.13,-1.435%,472456152.00,United States,2006,797489,Health Care,Biotechnology: Pharmaceutical Preparations
EBTC,Enterprise Bancorp Inc Common Stock,$31.19,-0.91,-2.835%,387512482.00,United States,,7800,Finance,Major Banks
EC,Ecopetrol S.A. American Depositary Shares,$8.10,0.07,0.872%,16652261354.00,Colombia,,1787910,Energy,Oil & Gas Production
ECAT,BlackRock ESG Capital Allocation Term Trust Common Shares of Beneficial Interest,$17.14,-0.11,-0.638%,1853433900.00,United States,2021,174233,Finance,Trusts Except Educational Religious and Charitable
ECBK,ECB Bancorp Inc. Common Stock,$14.99,0.01,0.067%,137726186.00,United States,2022,6126,Finance,Banks
ECC           ,Eagle Point Credit Company Inc. Common Stock,$9.61,0.04,0.418%,582966856.00,United States,2014,803626,Finance,Trusts Except Educational Religious and Charitable
ECC^D,Eagle Point Credit Company Inc. 6.75% Series D Preferred Stock,$19.90,-0.03,-0.151%,,United States,,26639,,
ECCC,Eagle Point Credit Company Inc. 6.50% Series C Term Preferred Stock due 2031,$23.4001,-0.0999,-0.425%,1419509128.00,United States,,4928,Finance,Trusts Except Educational Religious and Charitable
ECCF,Eagle Point Credit Company Inc. 8.00% Series F Term Preferred Stock due 2029,$24.855,-0.085,-0.341%,27058963140.00,United States,,3328,,
ECCV,Eagle Point Credit Company Inc. 5.375% Notes due 2029,$23.04,-0.01,-0.043%,1397664553.00,United States,2022,2118,Finance,Trusts Except Educational Religious and Charitable
ECCW,Eagle Point Credit Company Inc. 6.75% Notes due 2031,$24.60,-0.0662,-0.268%,1492298090.00,United States,2021,4100,Finance,Trusts Except Educational Religious and Charitable
ECCX,Eagle Point Credit Company Inc. 6.6875% Notes due 2028,$24.8635,0.1085,0.438%,1508282665.00,United States,2022,752,Finance,Trusts Except Educational Religious and Charitable
ECDA,ECD Automotive Design Inc. Common Stock,$1.01,-0.005,-0.493%,34996159.00,United States,2022,44694,Consumer Discretionary,Auto Manufacturing
ECF,Ellsworth Growth and Income Fund Ltd.,$9.275,-0.01,-0.108%,0.00,United States,1986,11481,Finance,Finance/Investors Services
